{
  "dataset_class": "DERIVED",
  "collection_attempt_id": "collect:small-business-credit:eeb04e1b57885b4fbda9dc27ddf2facf",
  "collection_run_id": "run:c85c3aa2b2525055bb330533a7285ba8",
  "product_key": "small-business-credit",
  "attempt_sequence": 2,
  "attempted_at": "2026-09-22T14:00:36.524273Z",
  "status": "SUCCEEDED",
  "observation_id": "obs:small-business-credit:3aad2aab1ffa5171a5b39b1c3b806c6c",
  "error_code": null,
  "error_message": null
}
