{
  "dataset_class": "DERIVED",
  "collection_attempt_id": "collect:boss-plus-overdraft:077f188646535ce1a1275d8db3870e80",
  "collection_run_id": "run:c85c3aa2b2525055bb330533a7285ba8",
  "product_key": "boss-plus-overdraft",
  "attempt_sequence": 2,
  "attempted_at": "2026-09-22T14:00:36.992221Z",
  "status": "SUCCEEDED",
  "observation_id": "obs:boss-plus-overdraft:c66d19b4b4f1573aa7521d9059cc3583",
  "error_code": null,
  "error_message": null
}
